{
  "schema_version": 1,
  "id": "hook-safety",
  "name": "Hook Safety",
  "description": "Global or project-scoped deterministic guards for destructive actions, policy bypasses, and sensitive reads.",
  "pipelines": [],
  "contents": {
    "mcp_refs": [],
    "commands": [],
    "prompts": [],
    "skills": [],
    "hooks": ["hook-pack-safety"],
    "settings": ["approval-policy"]
  },
  "targets": ["codex", "claude", "antigravity", "hermes"]
}
