{
  "schema_version": 1,
  "id": "hook-delegation",
  "name": "Hook Delegation",
  "description": "Explicit delegation contracts and bounded subagent outcome records across supported providers.",
  "pipelines": [],
  "contents": {
    "mcp_refs": [],
    "commands": [],
    "prompts": [],
    "skills": [],
    "hooks": ["hook-pack-delegation"],
    "settings": ["approval-policy"]
  },
  "targets": ["codex", "claude", "antigravity", "hermes"]
}
