{
  "schema_version": 1,
  "id": "standard-work",
  "name": "Standard Work",
  "description": "Provider-neutral guided delivery with a conditional architectural-direction gate, optional AI direction and plan review, explicit human decisions, implementation verification, mandatory change review, and optional PR preparation.",
  "tags": ["role/software-engineer", "workflow/delivery"],
  "pipelines": [
    {
      "id": "delivery",
      "name": "Delivery",
      "entry_phases": ["brief", "scout"],
      "phases": [
        "brief", "scout", "analyze", "research", "grill", "direction",
        "direction-review", "direction-decision", "plan", "prove",
        "plan-review", "decide", "ready", "handoff", "run", "verify",
        "review", "change-review", "pr", "session-analysis"
      ],
      "edges": [
        {"from": "brief", "to": "scout"},
        {"from": "scout", "to": "analyze"},
        {"from": "analyze", "to": "scout", "condition": "boundary evidence gap", "loop": true},
        {"from": "analyze", "to": "research", "condition": "research needed"},
        {"from": "analyze", "to": "grill", "condition": "human context needed and evidence sufficient"},
        {"from": "analyze", "to": "direction", "condition": "direction required and evidence sufficient"},
        {"from": "analyze", "to": "plan", "condition": "direction not required and evidence sufficient"},
        {"from": "research", "to": "grill", "condition": "human context needed"},
        {"from": "research", "to": "direction", "condition": "direction required and evidence sufficient"},
        {"from": "research", "to": "plan", "condition": "direction not required and evidence sufficient"},
        {"from": "grill", "to": "research", "condition": "evidence gap", "loop": true},
        {"from": "grill", "to": "direction", "condition": "direction required and evidence sufficient"},
        {"from": "grill", "to": "plan", "condition": "direction not required and evidence sufficient"},
        {"from": "direction", "to": "direction-review", "condition": "AI review selected"},
        {"from": "direction", "to": "direction-decision", "condition": "AI review skipped"},
        {"from": "direction", "to": "scout", "condition": "boundary evidence gap", "loop": true},
        {"from": "direction", "to": "research", "condition": "evidence gap", "loop": true},
        {"from": "direction", "to": "grill", "condition": "human constraint needed", "loop": true},
        {"from": "direction-review", "to": "direction-decision", "condition": "pass"},
        {"from": "direction-review", "to": "direction", "condition": "changes", "loop": true},
        {"from": "direction-review", "to": "research", "condition": "evidence gap", "loop": true},
        {"from": "direction-decision", "to": "plan", "condition": "approved"},
        {"from": "direction-decision", "to": "direction", "condition": "changes requested", "loop": true},
        {"from": "direction-decision", "to": "analyze", "condition": "rejected and reshape requested", "loop": true},
        {"from": "direction-decision", "to": "direction", "condition": "stale", "loop": true},
        {"from": "plan", "to": "prove", "condition": "expanded proof needed"},
        {"from": "plan", "to": "plan-review", "condition": "proof gate satisfied; AI review selected"},
        {"from": "plan", "to": "decide", "condition": "proof gate satisfied; AI review skipped"},
        {"from": "prove", "to": "plan-review", "condition": "AI review selected"},
        {"from": "prove", "to": "decide", "condition": "AI review skipped"},
        {"from": "plan-review", "to": "decide", "condition": "pass"},
        {"from": "plan-review", "to": "plan", "condition": "changes", "loop": true},
        {"from": "decide", "to": "ready", "condition": "approved"},
        {"from": "decide", "to": "plan", "condition": "changes", "loop": true},
        {"from": "decide", "to": "analyze", "condition": "rejected and reshape requested", "loop": true},
        {"from": "ready", "to": "handoff", "condition": "new executor"},
        {"from": "ready", "to": "run", "condition": "continuous session"},
        {"from": "ready", "to": "plan", "condition": "not ready", "loop": true},
        {"from": "handoff", "to": "run"},
        {"from": "run", "to": "verify"},
        {"from": "verify", "to": "review", "condition": "pass"},
        {"from": "verify", "to": "analyze", "condition": "failed", "loop": true},
        {"from": "review", "to": "run", "condition": "changes", "loop": true},
        {"from": "review", "to": "change-review", "condition": "pass"},
        {"from": "change-review", "to": "pr", "condition": "approved and publication requested"},
        {"from": "change-review", "to": "run", "condition": "changes requested", "loop": true},
        {"from": "change-review", "to": "analyze", "condition": "rejected and reshape requested", "loop": true},
        {"from": "change-review", "to": "change-review", "condition": "stale", "loop": true},
        {"from": "pr", "to": "session-analysis", "condition": "PR created and user accepts analysis"}
      ]
    },
    {
      "id": "pr-review",
      "name": "Pull Request Review",
      "entry_phases": ["resolve-destination"],
      "phases": [
        "resolve-destination", "sync-pr-context", "select-review-suite",
        "run-reviews", "synthesize-feedback", "implementation-approval",
        "internal-repair", "verify-repair", "pr-feedback"
      ],
      "edges": [
        {"from": "resolve-destination", "to": "sync-pr-context", "condition": "destination selected"},
        {"from": "sync-pr-context", "to": "select-review-suite"},
        {"from": "select-review-suite", "to": "run-reviews"},
        {"from": "run-reviews", "to": "synthesize-feedback"},
        {"from": "synthesize-feedback", "to": "implementation-approval", "condition": "internal repair review passes"},
        {"from": "synthesize-feedback", "to": "pr-feedback", "condition": "PR publication review passes"},
        {"from": "implementation-approval", "to": "internal-repair", "condition": "changes requested"},
        {"from": "implementation-approval", "to": "implementation-approval", "condition": "decision stale", "loop": true},
        {"from": "internal-repair", "to": "verify-repair"},
        {"from": "verify-repair", "to": "internal-repair", "condition": "verification failed", "loop": true},
        {"from": "verify-repair", "to": "run-reviews", "condition": "verification passes", "loop": true},
        {"from": "pr-feedback", "to": "sync-pr-context", "condition": "head, checks, or comments stale before publication", "loop": true},
        {"from": "pr-feedback", "to": "sync-pr-context", "condition": "post-publication reconciliation detects drift", "loop": true}
      ]
    }
  ],
  "contents": {
    "mcp_refs": [],
    "commands": [
      "work-start", "work-start-pr-review", "work-conductor", "work-brief", "work-scout", "work-analyze",
      "work-research", "work-grill", "work-direction", "work-decide", "work-ready", "work-plan", "work-prove",
      "work-plan-review", "work-handoff", "work-run", "work-run-simplify", "work-verify",
      "work-review", "work-review-simplify", "work-test-review", "work-change-review", "work-explain-change", "work-pr", "work-session-analysis", "work-showcase", "work-cleanup",
      "work-routing-preferences"
    ],
    "prompts": [],
    "skills": [
      "change-explanation-skill",
      "change-explanation-graph-contract",
      "multi-lens-review-skill",
      "readable-output-skill",
      "readable-output-project-naming",
      "readable-output-space-routing",
      "decision-capture-skill",
      "session-retrospective-skill",
      "work-routing-skill",
      "work-routing-runners",
      "readable-output-document-wording",
      "readable-output-task-context"
    ],
    "hooks": [],
    "settings": [
      "design-graph-policy", "review-policy", "review-report-schema", "work-routing-profile-schema",
      "approval-policy",
      "git-workflow-approvals-codex-rules",
      "git-workflow-approvals-claude-permissions",
      "retrospective-policy", "retrospective-record-schema", "retrospective-source-schema",
      "routine-development-approvals-codex-rules",
      "routine-development-approvals-claude-permissions"
    ]
  },
  "targets": ["codex", "claude", "antigravity", "hermes"]
}
