{
  "schema_version": 1,
  "id": "goreleaser-validation",
  "name": "GoReleaser Validation",
  "description": "Reviewable Claude Code and Codex approvals for the repository-scoped GoReleaser configuration check.",
  "pipelines": [],
  "contents": {
    "mcp_refs": [],
    "commands": [],
    "prompts": [],
    "skills": [],
    "hooks": [],
    "settings": [
      "goreleaser-validation-codex-rules",
      "goreleaser-validation-claude-permissions"
    ]
  },
  "targets": ["codex", "claude"],
  "environment_packs": ["goreleaser-validation"]
}
