{
  "schema_version": 1,
  "id": "hook-maintenance",
  "name": "Hook Maintenance",
  "description": "Repository-opt-in documentation impact and local index maintenance with nonblocking failure behavior.",
  "pipelines": [],
  "contents": {
    "mcp_refs": [],
    "commands": [],
    "prompts": [],
    "skills": [],
    "hooks": ["hook-pack-maintenance"],
    "settings": []
  },
  "targets": ["codex", "claude", "antigravity", "hermes"]
}
