{
  "schema_version": 1,
  "id": "maintainability-review-tools",
  "name": "Maintainability Review Tools",
  "description": "Install and verify the pinned jscpd executable used as advisory evidence by canonical maintainability implementation reviews.",
  "pipelines": [],
  "contents": {
    "mcp_refs": [],
    "commands": [],
    "prompts": [],
    "skills": [],
    "hooks": [],
    "settings": []
  },
  "targets": [],
  "environment_packs": ["maintainability-review"]
}
