{
  "schema_version": 1,
  "id": "terminal-orchestration",
  "name": "Terminal Orchestration",
  "description": "Install and verify the provider-neutral terminal tools used for local agent orchestration.",
  "pipelines": [],
  "contents": {
    "mcp_refs": [],
    "commands": [],
    "prompts": [],
    "skills": [],
    "hooks": [],
    "settings": []
  },
  "targets": [],
  "environment_packs": ["terminal-orchestration"]
}
