{
  "schema_version": 1,
  "id": "hook-standard",
  "name": "Hook Standard",
  "description": "Recommended safety, session continuity, and repository-opt-in quality hook definitions.",
  "pipelines": [],
  "contents": {
    "mcp_refs": [],
    "commands": [],
    "prompts": [],
    "skills": [],
    "hooks": ["hook-pack-safety", "hook-pack-continuity", "hook-pack-quality"],
    "settings": []
  },
  "targets": ["codex", "claude", "antigravity", "hermes"]
}
