{
  "schema_version": 1,
  "id": "hook-continuity",
  "name": "Hook Continuity",
  "description": "Session restore, pre-compaction checkpointing, and bounded end-of-session status capture without raw transcript retention.",
  "pipelines": [],
  "contents": {
    "mcp_refs": [],
    "commands": [],
    "prompts": [],
    "skills": [],
    "hooks": ["hook-pack-continuity"],
    "settings": []
  },
  "targets": ["codex", "claude", "antigravity", "hermes"]
}
