{
  "schema_version": 1,
  "id": "idea-shaping",
  "name": "Idea Shaping",
  "description": "Evidence-led shaping with bounded cross-system scouting, focused human questions, optional user sketches, a conditional architectural direction, optional AI review, and detailed planning.",
  "tags": ["role/software-engineer", "workflow/discovery"],
  "pipelines": [
    {
      "id": "shape",
      "name": "Shape",
      "entry_phases": ["intake"],
      "phases": [
        "intake", "scout", "analyze", "research", "grill", "brainstorm",
        "challenge", "decide", "direction", "direction-review", "direction-decision",
        "plan", "plan-review", "final"
      ],
      "edges": [
        {"from": "intake", "to": "scout", "condition": "system context linked"},
        {"from": "intake", "to": "analyze", "condition": "no linked system to scout"},
        {"from": "scout", "to": "analyze"},
        {"from": "analyze", "to": "scout", "condition": "boundary evidence gap", "loop": true},
        {"from": "analyze", "to": "research", "condition": "research needed"},
        {"from": "analyze", "to": "grill", "condition": "human context needed and evidence sufficient"},
        {"from": "analyze", "to": "brainstorm", "condition": "ready to compare options"},
        {"from": "research", "to": "grill", "condition": "human context needed"},
        {"from": "research", "to": "brainstorm", "condition": "ready to compare options"},
        {"from": "grill", "to": "brainstorm", "condition": "ready"},
        {"from": "brainstorm", "to": "challenge"},
        {"from": "challenge", "to": "direction", "condition": "direction required and viable candidates"},
        {"from": "challenge", "to": "decide", "condition": "direction not required and viable candidate"},
        {"from": "decide", "to": "plan", "condition": "human option choice recorded"},
        {"from": "direction", "to": "direction-review", "condition": "AI review selected"},
        {"from": "direction", "to": "direction-decision", "condition": "AI review skipped"},
        {"from": "direction", "to": "scout", "condition": "boundary evidence gap", "loop": true},
        {"from": "direction", "to": "research", "condition": "evidence gap", "loop": true},
        {"from": "direction", "to": "grill", "condition": "human constraint needed", "loop": true},
        {"from": "direction-review", "to": "direction-decision", "condition": "pass"},
        {"from": "direction-review", "to": "direction", "condition": "changes", "loop": true},
        {"from": "direction-review", "to": "research", "condition": "evidence gap", "loop": true},
        {"from": "direction-decision", "to": "plan", "condition": "approved"},
        {"from": "direction-decision", "to": "direction", "condition": "changes requested", "loop": true},
        {"from": "direction-decision", "to": "analyze", "condition": "rejected and reshape requested", "loop": true},
        {"from": "direction-decision", "to": "direction", "condition": "stale", "loop": true},
        {"from": "plan", "to": "plan-review", "condition": "AI review selected"},
        {"from": "plan", "to": "final", "condition": "AI review skipped"},
        {"from": "plan-review", "to": "final", "condition": "pass"},
        {"from": "plan-review", "to": "plan", "condition": "changes", "loop": true},
        {"from": "grill", "to": "research", "condition": "evidence gap", "loop": true},
        {"from": "challenge", "to": "brainstorm", "condition": "weak options", "loop": true},
        {"from": "challenge", "to": "grill", "condition": "missing constraint", "loop": true}
      ]
    }
  ],
  "contents": {
    "mcp_refs": [],
    "commands": [
      "work-shape", "work-source", "work-scout", "work-analyze", "work-grill", "work-brainstorm",
      "work-question", "work-research", "work-direction", "work-plan-review", "work-decide", "work-plan",
      "work-routing-preferences"
    ],
    "prompts": [],
    "skills": [
      "readable-output-skill",
      "readable-output-project-naming",
      "readable-output-space-routing",
      "work-routing-skill",
      "work-routing-runners",
      "readable-output-document-wording",
      "readable-output-task-context"
    ],
    "hooks": [],
    "settings": [
      "design-graph-policy", "review-policy", "review-report-schema",
      "work-routing-profile-schema"
    ]
  },
  "targets": ["codex", "claude", "antigravity", "hermes"]
}
